{
  "claim_boundary": "Allocated-job model staging and local hash verification only; no semantic descriptor, structural-signal, training, inference-efficiency, break-even, independent-review or peer-review result.",
  "contract_sha256": "fe4bec2cdf1d48f7c90b310288eadd1955edade940de1b9ddb82973b7dd53777",
  "created_at_utc": "2026-08-11T14:03:35Z",
  "descriptor_record_count": 0,
  "expected_repo_sha": "0c5384e84ac62ab0fe14a7f728a0f68ffd3f2186",
  "failures": [],
  "final_model_path": "/projects/hep/fs9/users/scyiu/RAKL-paper3/assets/BAAI--bge-reranker-v2-m3/953dc6f6f85a1b2dbfca4c34a2796e7dde08d41e",
  "frozen_parent_sha": "f86fb72eee1331fe083ce6de86bafe7fd727764f",
  "label_access": {
    "adjudication_accessed": false,
    "evaluated_result_accessed": false,
    "external_annotation_accessed": false
  },
  "model_execution_performed": false,
  "model_id": "BAAI/bge-reranker-v2-m3",
  "model_revision": "953dc6f6f85a1b2dbfca4c34a2796e7dde08d41e",
  "node": "cn040",
  "observed_model_files": [
    {
      "bytes": 795,
      "path": "config.json",
      "sha256": "13dcd6c31d9fec9d1d8e158702072f62d7fa7d312a64b9fe057bec9a08cfe41a"
    },
    {
      "bytes": 2271071852,
      "path": "model.safetensors",
      "sha256": "d9e3e081faff1eefb84019509b2f5558fd74c1a05a2c7db22f74174fcedb5286"
    },
    {
      "bytes": 5069051,
      "path": "sentencepiece.bpe.model",
      "sha256": "cfc8146abe2a0488e9e2a0c56de7952f7c11ab059eca145a0a727afce0db2865"
    },
    {
      "bytes": 964,
      "path": "special_tokens_map.json",
      "sha256": "8c785abebea9ae3257b61681b4e6fd8365ceafde980c21970d001e834cf10835"
    },
    {
      "bytes": 17098273,
      "path": "tokenizer.json",
      "sha256": "69564b696052886ed0ac63fa393e928384e0f8caada38c1f4864a9bfbf379c15"
    },
    {
      "bytes": 1173,
      "path": "tokenizer_config.json",
      "sha256": "7e4c1cc848840aeccdd763458c18dd525eb0f795c992e00ebe9c28554e7db2d4"
    }
  ],
  "runtime_staging_receipt_sha256": "f269788a78d216932879d2ea98eee3c1b84322b2345330406d8a7c6d81802c26",
  "runtime_tree_sha256": "8c0631333fa3bcaa71d0e5a0408183de4e0c8af145dfd9ccb5f3406386efdc73",
  "schema_version": "paper3-semantic-model-stage-execution-v1",
  "slurm_account": "lu2026-2-51",
  "slurm_job_id": "3476291",
  "slurm_partition": "lu48",
  "verdict": "STAGING_PASS_ATOMICALLY_PROMOTED"
}
